Unnamed: 0,review_id,rating_date,count_helpful,count_unhelpful,employee_length,employee_status,employee_type,flag_covid,flag_featured,flags_business_outlook,flags_ceo_approval,flags_recommend_frend,rating_culture_values,rating_diversity_inclusion,rating_overall,rating_work_life,summary,employee_location,employee_job_title,advice_to_management,review_pros,review_cons,rating_compensation_benefits,rating_senior_leadership,rating_career_opportunities,summary_cleaned,advice_to_management_cleaned,review_pros_cleaned,review_cons_cleaned,sentiment_polarity,sentiment_subjectivity,sentiment_label
86,87,2025-01-11T00:00:00.000Z,0.0,0.0,1.0,REGULAR,"Current employee, less than 1 year",False,False,POSITIVE,APPROVE,POSITIVE,5.0,5.0,3,3.0,Hard work,"Huntley, IL",Palletizer,Move people around so they can get a break on positions. Give equal work to everyone . My manager favors groups of people,Can work with friends and can sometimes take your time. The job comes with sOME benefits,"A lot of work on the body. Depending where you’re placed, you’re doing the same thing for 10+ hours straight . lifting heavy heavy boxes.",5.0,2.0,5.0,hard work,move people around get break positions give equal work everyone manager favors groups people,work friends sometimes take time job comes benefits,lot work body depending you’re placed you’re thing 10 hours straight lifting heavy heavy boxes,-0.2916666666666667,0.5416666666666666,negative
87,88,2025-01-10T00:00:00.000Z,0.0,0.0,0.0,PART_TIME,Current employee,False,False,,,,3.0,4.0,3,2.0,Rating,"Edison, NJ",Stower,,"Make own hours
Good pay
Free food sometimes","Receptive 
Brain mush
Boring
Physically and mentally draining",3.0,3.0,3.0,rating,,make hours good pay free food sometimes,receptive brain mush boring physically mentally draining,0.0,0.0,neutral
88,89,2025-01-10T00:00:00.000Z,0.0,0.0,4.0,REGULAR,Current employees,False,False,POSITIVE,APPROVE,NEGATIVE,4.0,4.0,3,4.0,Amazing company,"Hamilton, ON",Associate,Be kind,Benefit and vacation and TPO,Big loads hard hours long,4.0,4.0,4.0,amazing company,kind,benefit vacation tpo,big loads hard hours long,0.6000000000000001,0.9,positive
89,90,2025-01-10T00:00:00.000Z,0.0,0.0,2.0,REGULAR,Former employees,False,False,NEGATIVE,DISAPPROVE,NEGATIVE,1.0,4.0,3,3.0,Heavy lifting,"Grimes, IA",Associate,,"Ok money, good supervisors, swag bucks",Heavy lifting/ safety is a concern but don't expect them to care or pay you for your injuries,2.0,2.0,3.0,heavy lifting,,ok money good supervisors swag bucks,heavy lifting safety concern dont expect care pay injuries,-0.2,0.5,negative
90,91,2025-01-09T00:00:00.000Z,0.0,0.0,1.0,REGULAR,"Former employee, less than 1 year",False,False,,,,0.0,0.0,4,0.0,"Fulfillment Center Warehouse Associate Review – Amazon MTN1, Wilmington","Wilmington, DE",Fulfillment Center Warehouse Associate,"Streamline workflows to reduce strain during peak seasons.
Enhance recognition programs to boost morale.
Provide better training for new and current associates.
Act on employee feedback to improve job satisfaction.","Competitive pay and benefits (healthcare, 401k, stock options).
Opportunities for career advancement and skill development.
Fast-paced, engaging work environment.
Supportive team culture with approachable management.
Job stability with a global company.","Physically demanding, especially during peak seasons.
Long shifts with limited break times.
Fluctuating workload, sometimes stressful.
Noisy warehouse environment.",0.0,0.0,0.0,fulfillment center warehouse associate review – amazon mtn1 wilmington,streamline workflows reduce strain peak seasons enhance recognition programs boost morale provide better training new current associates act employee feedback improve job satisfaction,competitive pay benefits healthcare 401k stock options opportunities career advancement skill development fastpaced engaging work environment supportive team culture approachable management job stability global company,physically demanding especially peak seasons long shifts limited break times fluctuating workload sometimes stressful noisy warehouse environment,-0.1,0.1,neutral
91,92,2025-01-08T00:00:00.000Z,0.0,0.0,1.0,REGULAR,"Current employee, less than 1 year",False,False,POSITIVE,APPROVE,POSITIVE,1.0,1.0,2,1.0,It was terrible,"Monroe, OH",Cherry Picker,Stop flirting with employees and trying to get your way.,The pay was good that’s pretty much it,It’s a lot of drama and it’s all about who you know to do what you wanna do there. Even if you get a different roll you still will be paid the same.,5.0,1.0,1.0,terrible,stop flirting employees trying get way,pay good that’s pretty much,it’s lot drama it’s know wanna even get different roll still paid,-1.0,1.0,negative
92,93,2025-01-08T00:00:00.000Z,0.0,0.0,1.0,PART_TIME,"Current employee, less than 1 year",False,False,,,POSITIVE,4.0,4.0,4,5.0,Good Part Time opportunity,"Lubbock, TX",Seasonal Associate,,"The job is repetitive, relatively easy to learn. HR is onsite and helpful.","The job is physically demanding, but once you get used to it it isn't so bad. Work ethic varies greatly, and hard work is not appreciated besides compliments from managers.",4.0,3.0,3.0,good part time opportunity,,job repetitive relatively easy learn hr onsite helpful,job physically demanding get used isnt bad work ethic varies greatly hard work appreciated besides compliments managers,0.7,0.6000000000000001,positive
93,94,2025-01-03T00:00:00.000Z,0.0,0.0,2.0,REGULAR,Former employees,False,False,POSITIVE,DISAPPROVE,NEGATIVE,3.0,4.0,3,2.0,MCO1 Stow,"Orlando, FL",Warehouse Associate,stowers for waterspiders should not have such an indirect role -- they really do need just a little bit more direction/labor tracking.,"decent pay for the type of work
great benefits (insurance, 401k, company stock and education/Career Choice)
generous time-off policy
plenty of people to get to know if you are a people person","very physically demanding
keeping your job depends on your rate -- your rate can depend on your waterspider who may not care that you do not have enough work/""good"" work to make rate and stay out of the bottom 5%",4.0,3.0,2.0,mco1 stow,stowers waterspiders indirect role really need little bit directionlabor tracking,decent pay type work great benefits insurance 401k company stock educationcareer choice generous timeoff policy plenty people get know people person,physically demanding keeping job depends rate rate depend waterspider may care enough workgood work make rate stay bottom 5,0.0,0.0,neutral
94,95,2025-01-02T00:00:00.000Z,0.0,0.0,0.0,PART_TIME,Current employee,False,False,,,,1.0,5.0,3,5.0,Its okay,"Robbinsville, NJ",Warehouse Sortation Associate,,It pays the bills I guess.,The flex up / flex down thing here can be really annoying.,3.0,2.0,1.0,okay,,pays bills guess,flex flex thing really annoying,0.5,0.5,positive
95,96,2025-01-01T00:00:00.000Z,0.0,0.0,4.0,REGULAR,Former employees,False,False,NEUTRAL,NO_OPINION,POSITIVE,4.0,4.0,3,4.0,Good place,"Etna, OH",AA(Amazon Associate),Management keeps rotating,Work on your own terms,Heavy items when slow season,3.0,3.0,3.0,good place,management keeps rotating,work terms,heavy items slow season,0.7,0.6000000000000001,positive
96,97,2024-12-29T00:00:00.000Z,0.0,0.0,1.0,CONTRACT,"Current employee, less than 1 year",False,False,POSITIVE,APPROVE,POSITIVE,5.0,5.0,5,5.0,unkn,"Manchester, England",Warehouse Fulfillment Associate,the management is very good,Very good and nice culture,need to improve the salary range,5.0,5.0,5.0,unkn,management good,good nice culture,need improve salary range,0.0,0.0,neutral
97,98,2024-12-29T00:00:00.000Z,0.0,0.0,0.0,PART_TIME,Former employee,False,False,,,POSITIVE,0.0,0.0,5,0.0,A good place to work at,"Dallas, TX",ICQA Associate,Stay off the cat walk,The benefits starts on day1,The standing for a long period of times and short lunches,0.0,0.0,0.0,good place work,stay cat walk,benefits starts day1,standing long period times short lunches,0.7,0.6000000000000001,positive
98,99,2024-12-27T00:00:00.000Z,0.0,0.0,2.0,PART_TIME,Former employees,False,False,NEUTRAL,NO_OPINION,NEGATIVE,2.0,5.0,2,3.0,Wasn’t the greatest,"Greenfield, IN",Sorter Loader,,"The pay was good, and the time off accumulating every shift was nice","They really didn’t care about their workers when I worked there. 
Bathroom breaks were like they were not acceptable",2.0,3.0,2.0,wasn’t greatest,,pay good time accumulating every shift nice,really didn’t care workers worked bathroom breaks like acceptable,1.0,1.0,positive
99,100,2024-12-25T00:00:00.000Z,0.0,0.0,1.0,REGULAR,"Former employee, less than 1 year",False,False,NEGATIVE,DISAPPROVE,NEGATIVE,1.0,5.0,1,2.0,Not worth for the weather and long shifts,"Orlando, FL",Driver Associate,Don't tell your incoming employees that you'll offer bonuses and then say sike when they get hired,"Simple to do, 4 day work week","10 hour shifts and have to deal with heat and rain,",1.0,1.0,1.0,worth weather long shifts,dont tell incoming employees youll offer bonuses say sike get hired,simple 4 day work week,10 hour shifts deal heat rain,0.125,0.25,positive
100,101,2024-12-25T00:00:00.000Z,0.0,0.0,0.0,PART_TIME,Current employee,False,False,POSITIVE,APPROVE,POSITIVE,2.0,4.0,3,3.0,Decent,,Associate,,Decent pay here at this job nothing too crazy,As a part time you only get 15 mins break,2.0,3.0,3.0,decent,,decent pay job nothing crazy,part time get 15 mins break,0.16666666666666666,0.6666666666666666,positive
101,102,2024-12-17T00:00:00.000Z,0.0,0.0,0.0,REGULAR,Current employee,False,False,,,,5.0,5.0,5,5.0,A nice place to work,"Scarborough, ON",Warehouse Associate,,You will gain alot of knowledge,Be ready to stand for the whole shift,5.0,5.0,5.0,nice place work,,gain alot knowledge,ready stand whole shift,0.6,1.0,positive
102,103,2024-12-17T00:00:00.000Z,0.0,0.0,20.0,REGULAR,Current employees,False,False,,,POSITIVE,5.0,5.0,5,5.0,Great Benefits,"Charleston, TN",Human Resource Associate Partner,,Mutiple time off options. Above average health insurance options.,"Small department, not a lot of room to move up without moving.",4.0,5.0,5.0,great benefits,,mutiple time options average health insurance options,small department lot room move without moving,0.8,0.75,positive
103,105,2024-12-16T00:00:00.000Z,0.0,0.0,4.0,REGULAR,Current employees,False,False,,,,1.0,1.0,1,1.0,Physically Demanding job,"San Bernardino, CA",Quality Control,,lots of overtime. Worked 60hours/week,"The cons are the same as the pros, but this website doesn't allow me to copy the same response.",1.0,1.0,1.0,physically demanding job,,lots overtime worked 60hoursweek,cons pros website doesnt allow copy response,0.0,0.14285714285714285,neutral
104,106,2024-12-15T00:00:00.000Z,0.0,0.0,2.0,PART_TIME,Current employees,False,False,POSITIVE,DISAPPROVE,POSITIVE,3.0,4.0,4,3.0,Decent Pay,"Sparrows Point, MD",Associate,,"Freedom
Opportunities
Career choice
Decent Pay","Physically tiring
Poor Training
Not enough benefits",3.0,3.0,3.0,decent pay,,freedom opportunities career choice decent pay,physically tiring poor training enough benefits,0.16666666666666666,0.6666666666666666,positive
105,107,2024-12-15T00:00:00.000Z,0.0,0.0,2.0,REGULAR,Former employees,False,False,,,,1.0,3.0,1,1.0,Cold,"Rugeley, England",,,"Good managers, a lot of overtime available",Cold warehouse. Lonely isolating job,1.0,3.0,1.0,cold,,good managers lot overtime available,cold warehouse lonely isolating job,-0.6,1.0,negative
106,108,2024-12-14T00:00:00.000Z,0.0,0.0,2.0,REGULAR,Current employees,False,False,POSITIVE,APPROVE,POSITIVE,3.0,4.0,5,4.0,Pay,"St. Thomas, ON",Associate,,Good pay rate for Associates,Lot of internal politics in the Amazon warehouses,5.0,5.0,5.0,pay,,good pay rate associates,lot internal politics amazon warehouses,0.0,0.0,neutral
107,109,2024-12-12T00:00:00.000Z,0.0,0.0,0.0,REGULAR,Current employee,False,False,,,,0.0,0.0,5,0.0,Good place,"Council Bluffs, IA",Associate,,Good place to start a warehouse job.,Temperature is a little chilly.,0.0,0.0,0.0,good place,,good place start warehouse job,temperature little chilly,0.7,0.6000000000000001,positive
108,110,2024-12-11T00:00:00.000Z,0.0,0.0,2.0,REGULAR,Former employees,False,False,,,,0.0,0.0,3,0.0,Boring,"Jeffersonville, IN",ICQA Associate,,"PTO, same work every night.",Lots of turn over. Monotonous,0.0,0.0,0.0,boring,,pto work every night,lots turn monotonous,-1.0,1.0,negative
109,111,2024-12-08T00:00:00.000Z,0.0,0.0,4.0,REGULAR,Former employees,False,False,,,,5.0,5.0,4,4.0,Amazon,"Goodyear, AZ",Warehouse Worker,,They have really good benefits,Some jobs can get overwhelming,5.0,4.0,5.0,amazon,,really good benefits,jobs get overwhelming,0.0,0.0,neutral
110,112,2024-12-07T00:00:00.000Z,0.0,0.0,0.0,REGULAR,Current employee,False,False,,,,0.0,0.0,4,0.0,Good Job and Pay,"Leeds, England",Warehouse Associate,,"Easy, not much weight to handle","long shifts, stationed in one place",0.0,0.0,0.0,good job pay,,easy much weight handle,long shifts stationed one place,0.7,0.6000000000000001,positive
111,113,2024-12-05T00:00:00.000Z,0.0,0.0,4.0,REGULAR,Current employees,False,False,,,NEGATIVE,2.0,3.0,3,1.0,"Good money, hardwork","Edmonton, AB",Associate,,Good money better than average job,"Favouritism, no appreciation, more work you do more you’ll get, less work you do less they will give",3.0,3.0,3.0,good money hardwork,,good money better average job,favouritism appreciation work you’ll get less work less give,0.7,0.6000000000000001,positive
112,114,2024-12-04T00:00:00.000Z,0.0,0.0,9.0,REGULAR,Current employees,False,False,POSITIVE,NO_OPINION,POSITIVE,3.0,5.0,3,1.0,Hard work,"Windsor, CT",Packer,,Fast Advancements and great benefits,Very high turnover and not much accountability. Very long hours during holiday season.,3.0,3.0,3.0,hard work,,fast advancements great benefits,high turnover much accountability long hours holiday season,-0.2916666666666667,0.5416666666666666,negative
113,115,2024-12-03T00:00:00.000Z,0.0,0.0,2.0,PART_TIME,Current employees,False,False,POSITIVE,APPROVE,POSITIVE,3.0,3.0,3,3.0,Not Bad,"Avenel, NJ",FC Associate I,Lower the rate. Or increase the pay. And give out more shifts.,Simple work is required of you.,Their rate per hour is slightly unreasonable due to the fact if the items are heavy in total it’s harder to walk around while pushing the heavy cart.,3.0,3.0,3.0,bad,lower rate increase pay give shifts,simple work required,rate per hour slightly unreasonable due fact items heavy total it’s harder walk around pushing heavy cart,-0.6999999999999998,0.6666666666666666,negative
114,116,2024-12-03T00:00:00.000Z,0.0,0.0,4.0,REGULAR,Current employees,False,False,NEGATIVE,DISAPPROVE,NEGATIVE,1.0,1.0,1,1.0,Good benefits bad work culture,"Saint Louis, MO",Inbound Stower,"We are humans with our own lives outside of work. We are somebody’s child, wife, husband, father, mother or grandparent. We are not robots or machines to use and toss away whenever you feel like it. To some of us Amazon is one of our only choices to make a living for our families.","Great benefits, very flexible, lots of different positions to try out incase you don’t like your main role. Free holiday meals once a year. Come and leave work whenever you want using your unpaid time or pto. They lay for school and offer career programs although the tests to get into them are very difficult","Forced mandatory extra time. (My MET was 5 days of 11 1/2 hours and my regular shift is 3 days of 12 hours) you will get forced to cross trained and you will get labor shares to different departments wether you like that position or not. They have a very high expectations for making “rates” in your position. Managers and anyone in lead positions will micromanage and breathe down your neck. You are always getting watched and judged and everyone will shut down any minimal concern you have because nobody cares. They just care about saving their own behind. If you get hurt, well you better pray that you don’t because their AmCare will send you to their own doctor and they will lie and say you weren’t hurt at all so that they don’t have to pay for your injury or have you sue them. Some departments are very strict and WILL find reasons to write you up. You have to use some of your break time to get back to your station and sign in and scan something by the end of your break or you will get in trouble. You will use some of your break time just walking to the break area because it is SO far and so are the restrooms and don’t forget you need to use your break time to come back from break on time or you’ll get in trouble",3.0,1.0,3.0,good benefits bad work culture,humans lives outside work somebody’s child wife husband father mother grandparent robots machines use toss away whenever feel like us amazon one choices make living families,great benefits flexible lots different positions try incase don’t like main role free holiday meals year come leave work whenever want using unpaid time pto lay school offer career programs although tests get difficult,forced mandatory extra time met 5 days 11 12 hours regular shift 3 days 12 hours get forced cross trained get labor shares different departments wether like position high expectations making “rates” position managers anyone lead positions micromanage breathe neck always getting watched judged everyone shut minimal concern nobody cares care saving behind get hurt well better pray don’t amcare send doctor lie say weren’t hurt don’t pay injury sue departments strict find reasons write use break time get back station sign scan something end break get trouble use break time walking break area far restrooms don’t forget need use break time come back break time you’ll get trouble,5.551115123125783e-17,0.6333333333333333,neutral
115,117,2024-12-02T00:00:00.000Z,0.0,0.0,0.0,REGULAR,Former employee,False,False,,,,0.0,0.0,3,0.0,Amazon,"Orlando, FL",Picker,,A lot of hard work,Only care about the numbers,0.0,0.0,0.0,amazon,,lot hard work,care numbers,0.0,0.0,neutral
116,118,2024-11-30T00:00:00.000Z,0.0,0.0,2.0,PART_TIME,Current employees,False,False,,APPROVE,POSITIVE,5.0,5.0,5,4.0,Amazon review,"Ottawa, ON",Associate,,"It has good base pay, health benefits, and paid vacation.",Work is heavy sometimes and need physical strength.,5.0,5.0,5.0,amazon review,,good base pay health benefits paid vacation,work heavy sometimes need physical strength,0.0,0.0,neutral
117,119,2024-11-29T00:00:00.000Z,0.0,0.0,1.0,REGULAR,"Current employee, less than 1 year",False,False,,APPROVE,POSITIVE,0.0,0.0,5,5.0,I loved working there,"Coconut Creek, FL",Picker/Packer,"Focus on Employee Well-Being.
Encourage a balance between productivity and employee health. Consider frequent breaks, ergonomic assessments, and wellness programs.","Employment stability 
Competitive pay
Benefits 
Diverse workforce","Physical demands 
Management challenges 
Monotonous tasks
High turnover rates
Fast spaced environment",5.0,0.0,5.0,loved working,focus employee wellbeing encourage balance productivity employee health consider frequent breaks ergonomic assessments wellness programs,employment stability competitive pay benefits diverse workforce,physical demands management challenges monotonous tasks high turnover rates fast spaced environment,0.7,0.8,positive
118,120,2024-11-27T00:00:00.000Z,0.0,0.0,0.0,REGULAR,Former employee,False,False,,,,0.0,0.0,5,0.0,The pay is good but the work sometimes can be a bit.... Boring,"Charlotte, NC",Picking Associate,,Paid by the hour and if u stay long enough u get better pay well at least 1$ up,From what I've heard they treat ya like a number or a robot,0.0,0.0,0.0,pay good work sometimes bit boring,,paid hour u stay long enough u get better pay well least 1,ive heard treat ya like number robot,-0.15000000000000002,0.8,negative
119,121,2024-11-26T00:00:00.000Z,0.0,0.0,1.0,REGULAR,"Former employee, less than 1 year",False,False,POSITIVE,NO_OPINION,POSITIVE,3.0,5.0,4,2.0,Great place to start oit,"Calgary, AB",Dock Worker,,"Great benefits, great people to work with.",The work is very physically demanding,5.0,5.0,3.0,great place start oit,,great benefits great people work,work physically demanding,0.8,0.75,positive
120,122,2024-11-23T00:00:00.000Z,0.0,0.0,1.0,REGULAR,"Former employee, less than 1 year",False,False,POSITIVE,APPROVE,POSITIVE,4.0,3.0,4,3.0,Salary at Amazon,"Sioux Falls, SD",Reliability & Maintenance Engineering,,Good pay from the company and lovely colleagues,Too much heat and a lot of noise,4.0,4.0,4.0,salary amazon,,good pay company lovely colleagues,much heat lot noise,0.0,0.0,neutral
121,123,2024-11-20T00:00:00.000Z,0.0,0.0,0.0,REGULAR,Former employee,False,False,,,,2.0,1.0,2,3.0,nothign,"St. Thomas, ON",Warehouse Worker,,good pay and nice shift hours,politics and partiality play a major role,4.0,1.0,2.0,nothign,,good pay nice shift hours,politics partiality play major role,0.0,0.0,neutral
122,124,2024-11-19T00:00:00.000Z,0.0,0.0,2.0,REGULAR,Former employees,False,False,,,,3.0,3.0,3,1.0,General,"Dartford, England",Warehouse Operative,,Flexible working schedules and good pay,Extremely physical. Employees treated as machine sometimes.,4.0,3.0,4.0,general,,flexible working schedules good pay,extremely physical employees treated machine sometimes,0.05000000000000002,0.5,neutral
123,125,2024-11-18T00:00:00.000Z,0.0,0.0,0.0,REGULAR,Former employee,False,False,,,,1.0,1.0,1,1.0,Review,"Ottawa, ON",Warehouse Associate,"Treat associates with respect and dignity. Foster a more supportive environment, especially during challenging times, and ensure fair treatment for all employees, including those dealing with work-related injuries.","Good benefits.
Valuable working experience.
Opportunities to learn and grow.","Poor management support.
Lack of understanding during personal hardships.
Unfair treatment when injured on the job.
High-pressure environment with unrealistic expectations at times.",1.0,1.0,1.0,review,treat associates respect dignity foster supportive environment especially challenging times ensure fair treatment employees including dealing workrelated injuries,good benefits valuable working experience opportunities learn grow,poor management support lack understanding personal hardships unfair treatment injured job highpressure environment unrealistic expectations times,0.0,0.0,neutral
124,126,2022-11-17T00:00:00.000Z,0.0,0.0,1.0,REGULAR,Former employee,False,False,NEGATIVE,NO_OPINION,NEGATIVE,1.0,2.0,1,1.0,Worst place ever worked,,Fulfillment Expert,"The entire work culture needs to be changed. Management should treat people with compassion and empathy, and not the ruthless ways they opt to make people work out of fear of loosing their job.","To be honest, I met only one manager who seemed to be somewhat understanding and had human values and compassion towards her employees. Thats the only pros that I could remember so far.","Its the worst place that I have ever worked. Working conditions are extremely harsh. Needless to say, people are physically drained after their shifts and often managers or team leads wont be nice people to deal with. I once complained against one manager because he tried to bully me, and then lodged an official complaint against him. Nothing much happened after I lodged a complaint. It seems they don't treat you as a human, but rather as animals. Guys trust me, don't ever join this company, there are millions of good warehouses, and good pubs and restaurants to go and work if you want to work more towards physical endeavor. If you have some skillsets, apply to remote working or go for free lancing. But mark my words, never ever join this company as a fulfilment expert.",2.0,1.0,1.0,worst place ever worked,entire work culture needs changed management treat people compassion empathy ruthless ways opt make people work fear loosing job,honest met one manager seemed somewhat understanding human values compassion towards employees thats pros could remember far,worst place ever worked working conditions extremely harsh needless say people physically drained shifts often managers team leads wont nice people deal complained one manager tried bully lodged official complaint nothing much happened lodged complaint seems dont treat human rather animals guys trust dont ever join company millions good warehouses good pubs restaurants go work want work towards physical endeavor skillsets apply remote working go free lancing mark words never ever join company fulfilment expert,-1.0,1.0,negative
125,127,2022-11-11T00:00:00.000Z,0.0,0.0,1.0,REGULAR,Former employee,False,False,NO_OPINION,NO_OPINION,NO_OPINION,1.0,4.0,3,2.0,Too much work,,Process Associate,,A lot of work and lots of walking time. If u like walking . thjs is the job for you,"Too much walk , and things need more time to do",4.0,2.0,3.0,much work,,lot work lots walking time u like walking thjs job,much walk things need time,0.2,0.2,positive
126,128,2022-10-10T00:00:00.000Z,,,,REGULAR,Former employee,False,False,NO_OPINION,NO_OPINION,NO_OPINION,,,2,,"Long Hours, bad experience","Memphis, TN",Auditor,,The pay was ok and the other workers we’re easy to work with.,Management is awful! The conditions of the warehouse were also not the greatest.,,,,long hours bad experience,,pay ok workers we’re easy work,management awful conditions warehouse also greatest,-0.37499999999999994,0.5333333333333333,negative
127,129,2022-10-05T00:00:00.000Z,0.0,0.0,1.0,REGULAR,Former employee,False,False,NEGATIVE,NO_OPINION,NEGATIVE,5.0,5.0,1,1.0,Don't work here,"Saint Peters, MO",FC Associate I,,"Don't reccomend working here, you're just a number.","Treated like utter crap, over worked, under appreciated, You're just a number to them,",5.0,1.0,5.0,dont work,,dont reccomend working youre number,treated like utter crap worked appreciated youre number,0.0,0.0,neutral
