Unnamed: 0,review_id,rating_date,count_helpful,count_unhelpful,employee_length,employee_status,employee_type,flag_covid,flag_featured,flags_business_outlook,flags_ceo_approval,flags_recommend_frend,rating_culture_values,rating_diversity_inclusion,rating_overall,rating_work_life,summary,employee_location,employee_job_title,advice_to_management,review_pros,review_cons,rating_compensation_benefits,rating_senior_leadership,rating_career_opportunities,summary_cleaned,advice_to_management_cleaned,review_pros_cleaned,review_cons_cleaned,sentiment_polarity,sentiment_subjectivity,sentiment_label
128,130,2022-09-26T00:00:00.000Z,0.0,0.0,1.0,REGULAR,Current employee,False,False,NEGATIVE,NO_OPINION,NEGATIVE,1.0,5.0,1,1.0,Backbreaking Labor,"Euclid, OH",Warehouse - Picker,See the potential in hard working individuals sooner than later. And promote them before they burnout and loose interest.,Decent pay and fast hiring process.,"Backbreaking work and you will definitely feel under appreciated and overworked. Long hours (FT) a lot of walking, standing, micromanaging from upper-management.",3.0,3.0,1.0,backbreaking labor,see potential hard working individuals sooner later promote burnout loose interest,decent pay fast hiring process,backbreaking work definitely feel appreciated overworked long hours ft lot walking standing micromanaging uppermanagement,0.0,0.0,neutral
129,131,2022-09-21T00:00:00.000Z,0.0,0.0,,REGULAR,Current employee,False,False,NO_OPINION,NO_OPINION,NO_OPINION,,,3,,Workplace not conducive,,,,Pay is manageable but needs to pay more.,Managers practice favouritism at the site.,,,,workplace conducive,,pay manageable needs pay,managers practice favouritism site,0.0,0.0,neutral
130,132,2022-08-05T00:00:00.000Z,0.0,0.0,,REGULAR,Current employee,False,False,NO_OPINION,NO_OPINION,NO_OPINION,2.0,4.0,3,3.0,Working there,,Associate,Be more attentive to your employees,It was good pay at the time,You’re really over worked sometimes.,3.0,2.0,3.0,working,attentive employees,good pay time,you’re really worked sometimes,0.0,0.0,neutral
131,133,2022-07-23T00:00:00.000Z,0.0,0.0,1.0,REGULAR,Current employee,False,False,NEGATIVE,NO_OPINION,NO_OPINION,1.0,1.0,1,1.0,Horribles,,Ship Dock Worker,Manage don’t try to parent adults,None to be spoken of,Self degrading No management or really employees being trained correctly,1.0,1.0,1.0,horribles,manage don’t try parent adults,none spoken,self degrading management really employees trained correctly,0.0,0.0,neutral
132,134,2022-05-22T00:00:00.000Z,0.0,0.0,1.0,REGULAR,Former employee,False,False,NO_OPINION,NO_OPINION,NO_OPINION,,,3,,Alright,,Packer,,2 breaks through out the work day,Depending on the manager your with it can be smooth or bad,,,,alright,,2 breaks work day,depending manager smooth bad,0.0,0.0,neutral
133,135,2022-04-16T00:00:00.000Z,0.0,0.0,1.0,REGULAR,Former employee,False,False,POSITIVE,NO_OPINION,POSITIVE,2.0,5.0,3,5.0,An overall headache,"Memphis, TN",Warehousing Associate,"Communication, and promotions for those who deserve them not just those who you like.","The actual work is extremely easy. You work 4, 10 hour days and are off 3 or you can work 3, 12 hour days and have off 4 and you can even mix and match shifts in flex. You get paid time off, unpaid time off, vacation and if there’s no work then voluntary time off.","You can’t have a phone, social distancing is still in place so you can’t talk to anyone around you, you get a 15 min break but the break room is 5 mins away and buying something and paying for it usually takes a few min but yet you’re expected to make a 10 min walk and a 5 min purchase, and enjoy your break in less than 15 mins. managers do not communicate to anyone, Including their peers and hr. A lot like most jobs it’s a company run by little friend groups in each department that just find ways to shift blame and lack productivity. Also you must be labor tracked when you get there but PA’s will hold spots for their friends who are late forcing you to scavenge for a position elsewhere before the job assumes you’re stealing time. The company it’s self is wonderful, this building however will drive you mad",5.0,2.0,3.0,overall headache,communication promotions deserve like,actual work extremely easy work 4 10 hour days 3 work 3 12 hour days 4 even mix match shifts flex get paid time unpaid time vacation there’s work voluntary time,can’t phone social distancing still place can’t talk anyone around get 15 min break break room 5 mins away buying something paying usually takes min yet you’re expected make 10 min walk 5 min purchase enjoy break less 15 mins managers communicate anyone including peers hr lot like jobs it’s company run little friend groups department find ways shift blame lack productivity also must labor tracked get pa’s hold spots friends late forcing scavenge position elsewhere job assumes you’re stealing time company it’s self wonderful building however drive mad,0.0,0.0,neutral
134,136,2022-01-23T00:00:00.000Z,0.0,0.0,,REGULAR,Current employee,False,False,NEUTRAL,NO_OPINION,NEGATIVE,2.0,2.0,3,2.0,Great place to wor and it really means work hard,"Milwaukee, WI",Brand Ambassador,To make the individuals in Amazon grow before opening doors to others who don't know to much about how the department they are planning to run is ran. Don't just work the employees that work and allow PA to say something to those who choose to do minimum work,Overtime is always if you are one they know has good work ethics,Overworked because the ones who barely work PA is scared they will loose position if they be a little stricter. Some people even gets jealous if they see you working better than yhem,3.0,2.0,5.0,great place wor really means work hard,make individuals amazon grow opening doors others dont know much department planning run ran dont work employees work allow pa say something choose minimum work,overtime always one know good work ethics,overworked ones barely work pa scared loose position little stricter people even gets jealous see working better yhem,0.23611111111111108,0.49722222222222223,positive
135,137,2021-12-08T00:00:00.000Z,0.0,0.0,1.0,REGULAR,Former employee,False,False,NEUTRAL,NO_OPINION,NEGATIVE,3.0,3.0,4,4.0,Physical,,Warehouse Fulfillment Associate,Share the love by promoting women and men of color.,"You can work full-time if you want, the job is physical so you're constantly moving and if you're just looking for a job where you can just work and not be bothered, this is the job for you.",No gender or race equality in management.,4.0,3.0,4.0,physical,share love promoting women men color,work fulltime want job physical youre constantly moving youre looking job work bothered job,gender race equality management,0.0,0.14285714285714285,neutral
136,138,2021-11-23T00:00:00.000Z,0.0,0.0,3.0,REGULAR,Former employee,False,False,POSITIVE,NO_OPINION,POSITIVE,4.0,5.0,5,4.0,Great location,,Process Assistant,,"Team oriented, great people, great place to work",Peak time working 5 days a week.,4.0,2.0,4.0,great location,,team oriented great people great place work,peak time working 5 days week,0.8,0.75,positive
137,139,2021-10-23T00:00:00.000Z,0.0,0.0,,REGULAR,Current employee,False,False,NEUTRAL,NO_OPINION,NEGATIVE,3.0,3.0,2,2.0,It’s just okay,"Sacramento, CA",Learning Ambassador,,Shift swaps School accommodation Paid holidays,Managements sucks Tons of OT every week Long hours,3.0,1.0,2.0,it’s okay,,shift swaps school accommodation paid holidays,managements sucks tons ot every week long hours,0.5,0.5,positive
138,140,2021-06-27T00:00:00.000Z,0.0,0.0,,REGULAR,Former employee,False,False,NEUTRAL,NO_OPINION,NEGATIVE,2.0,3.0,3,1.0,Amazon fulfillment bwi2,"Baltimore, MD",Tier I Warehouse Associate,Treat us like humans ask the associates what's going on I'm not look at a computer screen all day looking at rates people make mistakes so do computers,Money is great great benefits can take off without asking through the Amazon app,Unrealistic rates needs to have longer breaks make room for error,5.0,1.0,2.0,amazon fulfillment bwi2,treat us like humans ask associates whats going im look computer screen day looking rates people make mistakes computers,money great great benefits take without asking amazon app,unrealistic rates needs longer breaks make room error,0.0,0.0,neutral
